{
  "assertions": [],
  "events": [
    {
      "at_ns": 1000000,
      "id": "link_down-bc-1",
      "link": "bc",
      "seq": 1,
      "type": "link_down"
    },
    {
      "at_ns": 2000000,
      "id": "link_up-bc-2",
      "link": "bc",
      "seq": 2,
      "type": "link_up"
    },
    {
      "at_ns": 3000000,
      "id": "router_down-b-3",
      "router": "b",
      "seq": 3,
      "type": "router_down"
    },
    {
      "at_ns": 4000000,
      "id": "router_up-b-4",
      "router": "b",
      "seq": 4,
      "type": "router_up"
    }
  ],
  "links": [
    {
      "a": "a",
      "b": "b",
      "cost_ab": 2,
      "cost_ba": 3,
      "id": "ab",
      "initial_state": "up"
    },
    {
      "a": "b",
      "b": "c",
      "cost_ab": 4,
      "cost_ba": 5,
      "id": "bc",
      "initial_state": "up"
    }
  ],
  "model": "ospf_spf_v1",
  "name": "chain",
  "prefixes": [
    {
      "origin": "a",
      "prefix": "10.10.1.0/24",
      "stub_cost": 2
    },
    {
      "origin": "b",
      "prefix": "10.10.2.0/24",
      "stub_cost": 3
    },
    {
      "origin": "c",
      "prefix": "10.10.3.0/24",
      "stub_cost": 4
    }
  ],
  "routers": [
    {
      "id": "a",
      "initial_state": "up",
      "router_id": "0.0.0.1"
    },
    {
      "id": "b",
      "initial_state": "up",
      "router_id": "0.0.0.2"
    },
    {
      "id": "c",
      "initial_state": "up",
      "router_id": "0.0.0.3"
    }
  ],
  "schema_version": 1
}
