{
  "assertions": [],
  "events": [
    {
      "at_ns": 1000000,
      "id": "link_down-ab-1",
      "link": "ab",
      "seq": 1,
      "type": "link_down"
    },
    {
      "at_ns": 2000000,
      "id": "link_up-ab-2",
      "link": "ab",
      "seq": 2,
      "type": "link_up"
    },
    {
      "at_ns": 3000000,
      "id": "router_down-e-3",
      "router": "e",
      "seq": 3,
      "type": "router_down"
    },
    {
      "at_ns": 4000000,
      "id": "router_up-e-4",
      "router": "e",
      "seq": 4,
      "type": "router_up"
    }
  ],
  "links": [
    {
      "a": "a",
      "b": "b",
      "cost_ab": 1,
      "cost_ba": 1,
      "id": "ab",
      "initial_state": "up"
    },
    {
      "a": "b",
      "b": "c",
      "cost_ab": 1,
      "cost_ba": 1,
      "id": "bc",
      "initial_state": "up"
    },
    {
      "a": "c",
      "b": "d",
      "cost_ab": 1,
      "cost_ba": 1,
      "id": "cd",
      "initial_state": "up"
    },
    {
      "a": "d",
      "b": "e",
      "cost_ab": 1,
      "cost_ba": 1,
      "id": "de",
      "initial_state": "up"
    },
    {
      "a": "a",
      "b": "e",
      "cost_ab": 1,
      "cost_ba": 1,
      "id": "ea",
      "initial_state": "up"
    }
  ],
  "model": "ospf_spf_v1",
  "name": "ring",
  "prefixes": [
    {
      "origin": "a",
      "prefix": "10.10.1.0/24",
      "stub_cost": 2
    },
    {
      "origin": "b",
      "prefix": "10.10.2.0/24",
      "stub_cost": 3
    },
    {
      "origin": "c",
      "prefix": "10.10.3.0/24",
      "stub_cost": 4
    },
    {
      "origin": "d",
      "prefix": "10.10.4.0/24",
      "stub_cost": 5
    },
    {
      "origin": "e",
      "prefix": "10.10.5.0/24",
      "stub_cost": 6
    }
  ],
  "routers": [
    {
      "id": "a",
      "initial_state": "up",
      "router_id": "0.0.0.1"
    },
    {
      "id": "b",
      "initial_state": "up",
      "router_id": "0.0.0.2"
    },
    {
      "id": "c",
      "initial_state": "up",
      "router_id": "0.0.0.3"
    },
    {
      "id": "d",
      "initial_state": "up",
      "router_id": "0.0.0.4"
    },
    {
      "id": "e",
      "initial_state": "up",
      "router_id": "0.0.0.5"
    }
  ],
  "schema_version": 1
}
