{"assertions":[{"destination":"10.0.60.1","id":"a000000","quantifier":"all","scope":"every_snapshot","source":"r0000","type":"must_reach"}],"events":[{"at_ns":1000000,"id":"e0001","link":"l0001-0002","seq":1,"type":"link_down"},{"at_ns":2000000,"id":"e0002","link":"l0001-0002","seq":2,"type":"link_up"},{"at_ns":3000000,"id":"e0003","link":"l0000-0001","seq":3,"type":"link_down"},{"at_ns":4000000,"id":"e0004","link":"l0000-0001","seq":4,"type":"link_up"},{"at_ns":5000000,"id":"e0005","router":"r0015","seq":5,"type":"router_down"},{"at_ns":6000000,"id":"e0006","router":"r0015","seq":6,"type":"router_up"},{"at_ns":7000000,"id":"e0007","link":"l0000-0001","seq":7,"type":"link_up"},{"at_ns":8000000,"id":"e0008","router":"r0015","seq":8,"type":"router_up"}],"links":[{"a":"r0000","b":"r0001","cost_ab":1,"cost_ba":1,"id":"l0000-0001","initial_state":"up"},{"a":"r0001","b":"r0002","cost_ab":1,"cost_ba":1,"id":"l0001-0002","initial_state":"up"},{"a":"r0002","b":"r0003","cost_ab":1,"cost_ba":1,"id":"l0002-0003","initial_state":"up"},{"a":"r0002","b":"r0006","cost_ab":1,"cost_ba":1,"id":"l0002-0006","initial_state":"up"},{"a":"r0002","b":"r0009","cost_ab":1,"cost_ba":1,"id":"l0002-0009","initial_state":"up"},{"a":"r0002","b":"r0014","cost_ab":1,"cost_ba":1,"id":"l0002-0014","initial_state":"up"},{"a":"r0003","b":"r0004","cost_ab":1,"cost_ba":1,"id":"l0003-0004","initial_state":"up"},{"a":"r0003","b":"r0014","cost_ab":1,"cost_ba":1,"id":"l0003-0014","initial_state":"up"},{"a":"r0004","b":"r0005","cost_ab":1,"cost_ba":1,"id":"l0004-0005","initial_state":"up"},{"a":"r0004","b":"r0011","cost_ab":1,"cost_ba":1,"id":"l0004-0011","initial_state":"up"},{"a":"r0005","b":"r0006","cost_ab":1,"cost_ba":1,"id":"l0005-0006","initial_state":"up"},{"a":"r0005","b":"r0013","cost_ab":1,"cost_ba":1,"id":"l0005-0013","initial_state":"up"},{"a":"r0006","b":"r0007","cost_ab":1,"cost_ba":1,"id":"l0006-0007","initial_state":"up"},{"a":"r0006","b":"r0014","cost_ab":1,"cost_ba":1,"id":"l0006-0014","initial_state":"up"},{"a":"r0007","b":"r0008","cost_ab":1,"cost_ba":1,"id":"l0007-0008","initial_state":"up"},{"a":"r0007","b":"r0009","cost_ab":1,"cost_ba":1,"id":"l0007-0009","initial_state":"up"},{"a":"r0007","b":"r0010","cost_ab":1,"cost_ba":1,"id":"l0007-0010","initial_state":"up"},{"a":"r0007","b":"r0015","cost_ab":1,"cost_ba":1,"id":"l0007-0015","initial_state":"up"},{"a":"r0008","b":"r0009","cost_ab":1,"cost_ba":1,"id":"l0008-0009","initial_state":"up"},{"a":"r0008","b":"r0012","cost_ab":1,"cost_ba":1,"id":"l0008-0012","initial_state":"up"},{"a":"r0008","b":"r0013","cost_ab":1,"cost_ba":1,"id":"l0008-0013","initial_state":"up"},{"a":"r0009","b":"r0010","cost_ab":1,"cost_ba":1,"id":"l0009-0010","initial_state":"up"},{"a":"r0009","b":"r0011","cost_ab":1,"cost_ba":1,"id":"l0009-0011","initial_state":"up"},{"a":"r0010","b":"r0011","cost_ab":1,"cost_ba":1,"id":"l0010-0011","initial_state":"up"},{"a":"r0010","b":"r0012","cost_ab":1,"cost_ba":1,"id":"l0010-0012","initial_state":"up"},{"a":"r0010","b":"r0015","cost_ab":1,"cost_ba":1,"id":"l0010-0015","initial_state":"up"},{"a":"r0011","b":"r0012","cost_ab":1,"cost_ba":1,"id":"l0011-0012","initial_state":"up"},{"a":"r0012","b":"r0013","cost_ab":1,"cost_ba":1,"id":"l0012-0013","initial_state":"up"},{"a":"r0013","b":"r0014","cost_ab":1,"cost_ba":1,"id":"l0013-0014","initial_state":"up"},{"a":"r0014","b":"r0015","cost_ab":1,"cost_ba":1,"id":"l0014-0015","initial_state":"up"}],"model":"ospf_spf_v1","name":"sparse-small-16","prefixes":[{"origin":"r0000","prefix":"10.0.0.0/24","stub_cost":1},{"origin":"r0015","prefix":"10.0.60.0/24","stub_cost":1}],"routers":[{"id":"r0000","initial_state":"up","router_id":"0.0.0.1"},{"id":"r0001","initial_state":"up","router_id":"0.0.0.2"},{"id":"r0002","initial_state":"up","router_id":"0.0.0.3"},{"id":"r0003","initial_state":"up","router_id":"0.0.0.4"},{"id":"r0004","initial_state":"up","router_id":"0.0.0.5"},{"id":"r0005","initial_state":"up","router_id":"0.0.0.6"},{"id":"r0006","initial_state":"up","router_id":"0.0.0.7"},{"id":"r0007","initial_state":"up","router_id":"0.0.0.8"},{"id":"r0008","initial_state":"up","router_id":"0.0.0.9"},{"id":"r0009","initial_state":"up","router_id":"0.0.0.10"},{"id":"r0010","initial_state":"up","router_id":"0.0.0.11"},{"id":"r0011","initial_state":"up","router_id":"0.0.0.12"},{"id":"r0012","initial_state":"up","router_id":"0.0.0.13"},{"id":"r0013","initial_state":"up","router_id":"0.0.0.14"},{"id":"r0014","initial_state":"up","router_id":"0.0.0.15"},{"id":"r0015","initial_state":"up","router_id":"0.0.0.16"}],"schema_version":1}
